{
  "$schema": "./v20_terminal_acceptance.schema.json",
  "libraryPath": "D:\\papers\\library.jsonl",
  "databaseDir": "D:\\ResearchHotspotsDesktop\\library",
  "importBeforeAudit": true,
  "minValidRows": 100000,
  "minImportedRows": 100000,
  "minClusters": 10,
  "exportStarMap": true,
  "minStarMapHotspots": 10,
  "minStarMapEvidenceIds": 10,
  "minStarMapLinks": 1,
  "minStarMapEvidenceCoverage": 0.8,
  "minStarMapEvolutionCoverage": 0.8,
  "minStarMapSourceDistributionCoverage": 0.8,
  "rejectSampleStarMapSignals": true,
  "exportHotspotEvidence": true,
  "minHotspotRepresentativePapers": 3,
  "generateHotspotReport": true,
  "minHotspotReportPapers": 3,
  "minReportCitations": 3,
  "minReportReferences": 3,
  "minReportChars": 1200,
  "uiSmokePath": "outputs\\v20_ui_final_smoke.json",
  "aiLiveSmokePath": "outputs\\v20_ai_live_report_smoke.json",
  "requireLiveAi": true,
  "requireTerminalReady": true,
  "runPressureTest": true,
  "runTauriBuild": true,
  "launchExe": true
}
